Title,Link,Date,Views,File_name,Label
แอนนี่ บรู๊ค เปิดหมดใจ! ถอนชื่อพ่อฑีฆายุ,https://www.sanook.com/news/1124771/,18-มิ.ย.-55,"265,823",ข่าวบันเทิง_1387.txt,ข่าวบันเทิง
สวยหวานมาก เอ็ม บุษราคัม ลูกสาวหม่ำ ลองชุดเจ้าสาว,https://www.sanook.com/news/1964930/,16-มี.ค.-59,"265,687",ข่าวบันเทิง_1388.txt,ข่าวบันเทิง
แต้ว เคลียร์ดราม่า! ผิดเหรอ..นางเอกใส่บิกินี่เล่นน้ำ,https://www.sanook.com/news/1763059/,13-มี.ค.-58,"265,573",ข่าวบันเทิง_1389.txt,ข่าวบันเทิง
เปิ้ล-จูน เคลียร์! กินยาลดความอ้วนตอนท้อง,https://www.sanook.com/news/1767483/,21-มี.ค.-58,"265,562",ข่าวบันเทิง_1390.txt,ข่าวบันเทิง
บุ๋ม ปนัดดา ชี้แจงแทน สังคมสงสัย? ดาราอาวุโสไม่มีเงินเก็บ,https://www.sanook.com/news/1793530/,10-พ.ค.-58,"265,498",ข่าวบันเทิง_1391.txt,ข่าวบันเทิง
"ละม่อม ทองเนื้อเก้า เจ้าของคำฮิต ""ไข่ตุ้ม"" ขอแก้ข่าว...",https://www.sanook.com/news/1294667/,30-ต.ค.-56,"265,415",ข่าวบันเทิง_1392.txt,ข่าวบันเทิง
อดีตถึงปัจจุบัน! เป้ย ปานวาด นางร้ายโคตรเซ็กชี่,https://www.sanook.com/news/998170/,22-ก.พ.-54,"265,353",ข่าวบันเทิง_1393.txt,ข่าวบันเทิง
หนูก็รักของหนู “มิ้นท์” เมินคนเม้าท์แฟนไม่หล่อ ยันไม่ได้ตกถังข้าวสาร!!,https://www.sanook.com/news/2228886/,18-พ.ค.-60,"265,083",ข่าวบันเทิง_1394.txt,ข่าวบันเทิง
"""ตุ้ย ธีรภัทร์"" เปิดหมดใจ จบแล้วรัก 11 ปี เหตุผลหย่า ""นาตาชา"" เรามองชีวิตต่างกัน",https://www.sanook.com/news/7883206/,1-ก.ย.-62,"265,063",ข่าวบันเทิง_1395.txt,ข่าวบันเทิง
ประกาศฉบับที่ 18 อาการ ปอ ทฤษฎี หลังผ่าตัดปอดซ้ายออก,https://www.sanook.com/news/1920274/,24-ธ.ค.-58,"264,871",ข่าวบันเทิง_1396.txt,ข่าวบันเทิง
"""เจ้าขุน"" โพสต์ความในใจ ชาวเน็ตถล่มยับ ดราม่าเดือดบนสังเวียน 10 Fight 10",https://www.sanook.com/news/7864474/,13-ส.ค.-62,"264,827",ข่าวบันเทิง_1397.txt,ข่าวบันเทิง
เมย์ ประกาศเลิก เจ ทั้งที่ยังรักกันมาก เผยกำลังจะเป็นโรคซึมเศร้า,https://www.sanook.com/news/5019366/,18-ม.ค.-61,"264,801",ข่าวบันเทิง_1398.txt,ข่าวบันเทิง
เป็นเรื่อง!! แจ๊บ เพ็ญเพ็ชร บ้านร้าว? โพสต์ประจานเมียขู่ทิ้งลูก,https://www.sanook.com/news/1298900/,4-พ.ย.-56,"264,723",ข่าวบันเทิง_1399.txt,ข่าวบันเทิง
ยุ้ย ปัทมวรรณ เผยปาฏิหาริย์มีจริง แม่ทุม ตอบสนองจำชื่อลูกได้,https://www.sanook.com/news/1761065/,10-มี.ค.-58,"264,686",ข่าวบันเทิง_1400.txt,ข่าวบันเทิง
กานต์ เปิดใจ! จบมหากาพย์ เสก ส่งเสียค่าเลี้ยงดูลูก 17 ล้าน,https://www.sanook.com/news/1810702/,11-มิ.ย.-58,"264,619",ข่าวบันเทิง_1401.txt,ข่าวบันเทิง
คู่รักดาราเบี้ยวค่าแต่งงาน หลายคู่ถูกเอี่ยวออกมาชี้แจง,https://www.sanook.com/news/1793339/,9-พ.ค.-58,"264,336",ข่าวบันเทิง_1402.txt,ข่าวบันเทิง
พั้นช์ วรกาญจน์ ควงแฟนหนุ่มเข้าพิธีวิวาห์ ฝากตัวเป็นสะใภ้เมืองชุมพร,https://www.sanook.com/news/4132266/,5-พ.ย.-60,"264,307",ข่าวบันเทิง_1403.txt,ข่าวบันเทิง
บอล เชิญยิ้ม ให้อภัย เมียศร น้ำตานอง ขอโทษที่ปากพล่อย!,https://www.sanook.com/news/2057462/,29-ส.ค.-59,"264,197",ข่าวบันเทิง_1404.txt,ข่าวบันเทิง
“คิทตี้ ชิชา” เปลือยเต้าเดินแฟชั่นโชว์ สตรองแค่ไหนถามใจเธอดู,https://www.sanook.com/news/3524450/,15-ก.ย.-60,"264,140",ข่าวบันเทิง_1405.txt,ข่าวบันเทิง
เจนี่ รับคำท้า Ice Bucket Challenge คลิปโผล่หนุ่มปริศนา,https://www.sanook.com/news/1653485/,22-ส.ค.-57,"263,745",ข่าวบันเทิง_1406.txt,ข่าวบันเทิง
อเล็กซ์ เผยน้องชาย เต้ย ป่วยหนัก เชื่อมีโอกาสหาย,https://www.sanook.com/news/1820351/,28-มิ.ย.-58,"263,566",ข่าวบันเทิง_1407.txt,ข่าวบันเทิง
"""ป๊อป นิธิ"" ดูละครบุพเพสันนิวาส ทำให้รู้ว่า ""หลวงศรียศ"" คือบรรพบุรุษของตระกูล",https://www.sanook.com/news/5790462/,23-มี.ค.-61,"263,432",ข่าวบันเทิง_1408.txt,ข่าวบันเทิง
"""หม่อมเอ็ม"" โชว์ให้เห็นชัดๆ คางที่เคยยื่น ตอนนี้ไม่มีแล้ว ศัลยกรรมเปลี่ยนชีวิต",https://www.sanook.com/news/7854230/,4-ส.ค.-62,"263,388",ข่าวบันเทิง_1409.txt,ข่าวบันเทิง
"""ธีร์ ภูมิธนะวัชร์"" อดีตดาราขอโอกาสทั้งคราบน้ำตา ป่วยหนักวัณโรครุมเร้า",https://www.sanook.com/news/7822626/,3-ก.ค.-62,"263,229",ข่าวบันเทิง_1410.txt,ข่าวบันเทิง
กรี๊ดหนักมาก! ว่าน ร้องเพลงเซอร์ไพรส์ ฟาง กลางคอนเสิร์ต,https://www.sanook.com/news/2052586/,21-ส.ค.-59,"263,135",ข่าวบันเทิง_1411.txt,ข่าวบันเทิง
มะนาว ศรศิลป์ เหวอ! ภาพฉาวเป็นเมียน้อย บรรหาร,https://www.sanook.com/news/1208092/,11-ก.ย.-56,"263,126",ข่าวบันเทิง_1412.txt,ข่าวบันเทิง
"""ต้นหอม ศกุนตลา"" โพสต์ภาพอัลตราซาวด์ แฟนๆ แห่แสดงความยินดี",https://www.sanook.com/news/7223934/,18-ก.ค.-61,"262,983",ข่าวบันเทิง_1413.txt,ข่าวบันเทิง
อาร์ต โดนแฉขึ้นคอนโดหาสาว บ้ากามขอดูรูปหวิว,https://www.sanook.com/news/1134546/,6-ส.ค.-55,"262,903",ข่าวบันเทิง_1414.txt,ข่าวบันเทิง
"สุดชื่นมื่น ""น้องนนนี่"" ลูกสาว ""แอน สิเรียม"" เข้าพิธีแต่งงานแล้ว",https://www.sanook.com/news/7892414/,10-ก.ย.-62,"262,812",ข่าวบันเทิง_1415.txt,ข่าวบันเทิง
ทายปริศนาภาพ 9 คนดังวัยเด็ก? คุณอาจจะนึกไม่ถึง,https://www.sanook.com/news/1728957/,10-ม.ค.-58,"262,802",ข่าวบันเทิง_1416.txt,ข่าวบันเทิง
"ยั่วๆ ฮาๆ ""กิ๊บซี่-ปันปัน- มายด์-แอมแปร์"" เต้นเพลงมะล่องก่องแก่ง แอบโฟกัสผิดจุด",https://www.sanook.com/news/8030262/,11-ก.พ.-63,"262,686",ข่าวบันเทิง_1417.txt,ข่าวบันเทิง
เปิดเรือนหอ นัท อั้ม ราคาเฉียด 30 ล้านบาท,https://www.sanook.com/news/1591838/,29-เม.ย.-57,"262,686",ข่าวบันเทิง_1418.txt,ข่าวบันเทิง
ชาวเน็ตจวกยับ! เบนซ์ ทำไมต้องแรง ขุดเช็ทถ่ายแบบเปรียบเทียบ,https://www.sanook.com/news/1124657/,18-มิ.ย.-55,"262,595",ข่าวบันเทิง_1419.txt,ข่าวบันเทิง
ลิเดีย แมทธิว แจงดราม่า ชุดเจ้าสาวโป๊เกินเหตุ!!,https://www.sanook.com/news/1769109/,24-มี.ค.-58,"262,525",ข่าวบันเทิง_1420.txt,ข่าวบันเทิง
"""เอก"" โชว์ปกป้องภรรยา ""บุ๋ม"" ถูกลวนลามที่งานสงกรานต์",https://www.sanook.com/news/1780951/,15-เม.ย.-58,"262,463",ข่าวบันเทิง_1421.txt,ข่าวบันเทิง
น้ำเพชร โต้ภาพหลุดถ่ายแบบสยิว ลั่น หนูยังไม่มีผัว,https://www.sanook.com/news/1731813/,15-ม.ค.-58,"262,366",ข่าวบันเทิง_1422.txt,ข่าวบันเทิง
นุ่น ศิรพันธ์ เกี่ยวก้อย ท็อป พิพัฒน์ ฉลองวิวาห์รักษ์โลก เก๋ไก๋ทั้งงาน,https://www.sanook.com/news/1852778/,23-ส.ค.-58,"262,314",ข่าวบันเทิง_1423.txt,ข่าวบันเทิง
น้ำตาคลอ หนิง รับรู้ จิน นอกใจแต่ให้อภัยเพราะลูก!!,https://www.sanook.com/news/1176895/,27-มี.ค.-56,"262,249",ข่าวบันเทิง_1424.txt,ข่าวบันเทิง
คุณหมอสุดสวย หมอพลอย ความภูมิใจของคุณแม่ดี้ ปัทมา,https://www.sanook.com/news/2169658/,16-ก.พ.-60,"262,156",ข่าวบันเทิง_1425.txt,ข่าวบันเทิง
"""เจนี่"" โพสต์คลิปลูกสาวครั้งแรก ""น้องโนล่า"" ในอ้อมแขนพ่อมิกกี้",https://www.sanook.com/news/7969654/,1-ธ.ค.-62,"262,137",ข่าวบันเทิง_1426.txt,ข่าวบันเทิง
แทค สลัดลุคเซอร์! ขึ้นแท่นผู้บริหารวิลล่าหรู 150 ล้าน,https://www.sanook.com/news/2072094/,23-ก.ย.-59,"261,869",ข่าวบันเทิง_1427.txt,ข่าวบันเทิง
'อั้ม พัชราภา' คนจริง บอก แอมป์ พิธาน ขอแอร์เมสใส่ตู้,https://www.sanook.com/news/1949314/,14-ก.พ.-59,"261,803",ข่าวบันเทิง_1428.txt,ข่าวบันเทิง
"""วุ้นเส้น วิริฒิพา"" ยิ่งโสดยิ่งแซ่บ ถ่ายแบบชุดชั้นใน เผ็ดมากจนถูกแซว",https://www.sanook.com/news/8047290/,6-มี.ค.-63,"261,692",ข่าวบันเทิง_1429.txt,ข่าวบันเทิง
แบงค์ ธิติ ไขข้อข้องใจ!? ดังแล้วเวอร์ กลัวเค้กส้ม,https://www.sanook.com/news/1885111/,19-ต.ค.-58,"261,633",ข่าวบันเทิง_1430.txt,ข่าวบันเทิง
"ความสุขของ ""เสี่ยตา ปัญญา"" กับหลานสาวในอาณาจักรบ้านไร่",https://www.sanook.com/news/2026614/,8-ก.ค.-59,"261,629",ข่าวบันเทิง_1431.txt,ข่าวบันเทิง
คลิปเสียงฉาวดาราชมพูโผล่อีก คราวนี้เมียหลวงฉะกับแม่!,https://www.sanook.com/news/1135036/,8-ส.ค.-55,"261,627",ข่าวบันเทิง_1432.txt,ข่าวบันเทิง
เคลื่อนศพ ปอ ทฤษฎี ขึ้นสู่เมรุ รอพระราชทานเพลิง,https://www.sanook.com/news/1936891/,24-ม.ค.-59,"261,625",ข่าวบันเทิง_1433.txt,ข่าวบันเทิง
กฤต นักข่าวช่อง 3 ตื่นมาช้ำ เบนซ์คันเป็นล้าน จมน้ำท่วม,https://www.sanook.com/news/3871038/,14-ต.ค.-60,"261,402",ข่าวบันเทิง_1434.txt,ข่าวบันเทิง
สวยสง่า โบว์ แวนด้า อุ้มน้องมะลิ ถ่ายแบบ,https://www.sanook.com/news/1947374/,11-ก.พ.-59,"261,301",ข่าวบันเทิง_1435.txt,ข่าวบันเทิง
หยุดดราม่า! กุ๊บกิ๊บ เผยรูปนี้แค่อยากอวดรอยสัก,https://www.sanook.com/news/1747603/,13-ก.พ.-58,"261,292",ข่าวบันเทิง_1436.txt,ข่าวบันเทิง
บุคคลปริศนา ซื้อรถเบนซ์เซอร์ไพรส์วันเกิดแตงโม ภัทรธิดา,https://www.sanook.com/news/1869202/,21-ก.ย.-58,"261,187",ข่าวบันเทิง_1437.txt,ข่าวบันเทิง
อี๊ด โปงลาง เปิดใจข่าวตกอับ ไม่เสียใจชีวิตเป็นแบบนี้้,https://www.sanook.com/news/1631921/,17-ก.ค.-57,"261,179",ข่าวบันเทิง_1438.txt,ข่าวบันเทิง
น้องแพร อดีตดาราเด็ก เครียดคนเม้าท์สวยเพราะศัลยกรรม,https://www.sanook.com/news/1814935/,19-มิ.ย.-58,"261,091",ข่าวบันเทิง_1439.txt,ข่าวบันเทิง
"โรแมนติก ""สายฟ้า เศรษฐบุตร"" เข้าพิธีแต่งงานแล้วกับเจ้าสาวไฮโซสุดสวย",https://www.sanook.com/news/7507490/,15-ก.ย.-61,"261,024",ข่าวบันเทิง_1440.txt,ข่าวบันเทิง
แพท เล่าวินาทีอุ้มลูกไปเยี่ยม เบนซ์ ถ้าทำใจไม่ได้ก็อย่าเป็นพ่อ,https://www.sanook.com/news/4569870/,11-ธ.ค.-60,"260,908",ข่าวบันเทิง_1441.txt,ข่าวบันเทิง
ไม่ต้องดราม่า ชมพู่ ส่งพวงหรีดอาลัย น้องอิน อาไข่หวานไม่ลืมมดตะนอย,https://www.sanook.com/news/6020386/,11-เม.ย.-61,"260,894",ข่าวบันเทิง_1442.txt,ข่าวบันเทิง
"เปิดหมดเปลือก...ชีวิตและหัวใจ ""พิมพ์มาดา""",https://www.sanook.com/news/2052894/,22-ส.ค.-59,"260,709",ข่าวบันเทิง_1443.txt,ข่าวบันเทิง
เปิ้ล ไอริณ ร่ำไห้! บุกเคลียร์ ใบเตย สั่งถอดหนัง,https://www.sanook.com/news/1597613/,23-พ.ค.-57,"260,569",ข่าวบันเทิง_1444.txt,ข่าวบันเทิง
เจนสุดา ควง พอล เข้าพิธีวิวาห์ แก๊งนางฟ้ายกขบวนเป็นเพื่อนเจ้าสาว,https://www.sanook.com/news/1926318/,6-ม.ค.-59,"260,364",ข่าวบันเทิง_1445.txt,ข่าวบันเทิง
เฮีย แฉชุดใหญ่! แอนนี่ ไม่ได้มีแค่ ฟิล์ม,https://www.sanook.com/news/969670/,28-ก.ย.-53,"260,243",ข่าวบันเทิง_1446.txt,ข่าวบันเทิง
เจ้าขุน เจ้าสมุทร ลูกชายเจ-ปิ่น อาหารญี่ปุ่นร้านดังทำพิษ หามส่งรพ.,https://www.sanook.com/news/1922690/,29-ธ.ค.-58,"260,242",ข่าวบันเทิง_1447.txt,ข่าวบันเทิง
ซันนี่ เคลียร์ให้ชัด! ทำไมค่าตัวทั้งเรื่องน้อยกว่า ใหม่ ดาวิกา,https://www.sanook.com/news/1883839/,16-ต.ค.-58,"260,237",ข่าวบันเทิง_1448.txt,ข่าวบันเทิง
เมทัล งานเข้า! โดนปล่อยรูปคลิปหลุดหน้าคล้ายในห้องน้ำ,https://www.sanook.com/news/1994854/,13-พ.ค.-59,"260,210",ข่าวบันเทิง_1449.txt,ข่าวบันเทิง
กาละแมร์ ชี้แจงเรื่องคำพูดไร้รสนิยมใส่ชุดบอลเดินห้าง,https://www.sanook.com/news/2008462/,8-มิ.ย.-59,"260,199",ข่าวบันเทิง_1450.txt,ข่าวบันเทิง
"เปิดใจแบบแมนๆ ""ฌอห์ณ"" ฝากถึง ""เอสเธอร์"" สเตตัสวันนี้เราคืออะไร?",https://www.sanook.com/news/1808495/,7-มิ.ย.-58,"260,018",ข่าวบันเทิง_1451.txt,ข่าวบันเทิง
เจ็ท ณัฐพงศ์ แฟนหนุ่มคิมเบอร์ลี่ โพสต์ดุเดือด,https://www.sanook.com/news/1190761/,10-มิ.ย.-56,"259,931",ข่าวบันเทิง_1452.txt,ข่าวบันเทิง
"ว่าที่คุณแม่คนใหม่ ""เอิร์น เดอะสตาร์"" ท้องแล้ว 7 เดือน",https://www.sanook.com/news/1891222/,30-ต.ค.-58,"259,584",ข่าวบันเทิง_1453.txt,ข่าวบันเทิง
โอปอล์ ท้องแล้ว อายุครรภ์ 10 สัปดาห์ 4 วัน,https://www.sanook.com/news/1797378/,18-พ.ค.-58,"259,517",ข่าวบันเทิง_1454.txt,ข่าวบันเทิง
อั้ม ว่าไง? ถูกจับตาสินสอดเทียบเท่าชมพู่,https://www.sanook.com/news/1806215/,3-มิ.ย.-58,"259,423",ข่าวบันเทิง_1455.txt,ข่าวบันเทิง
"""ป๊อป นิธิ"" โพสต์แล้ว แคปชั่นชัดเจนถึง ""เป้ย ปานวาด""",https://www.sanook.com/news/8209338/,16-ก.ค.-63,"259,363",ข่าวบันเทิง_1456.txt,ข่าวบันเทิง
"""มนต์สิทธิ์"" เอาใจคอหวย จัดให้ชุดใหญ่ แจกเลขเด็ด งวด 1 ก.พ.",https://www.sanook.com/news/7662334/,30-ม.ค.-62,"259,335",ข่าวบันเทิง_1457.txt,ข่าวบันเทิง
"วู้ดดี้ ยอมจำนน ควักเงิน 2 แสนให้หลาน ""เป่าเป่า"" เรียกชื่อได้",https://www.sanook.com/news/2174570/,25-ก.พ.-60,"259,315",ข่าวบันเทิง_1458.txt,ข่าวบันเทิง
"ฟังจากปากเรื่องดีๆ ที่ ""พีค"" ยังลืม ""เต๋อ"" ไม่ลง!",https://www.sanook.com/news/1807943/,6-มิ.ย.-58,"259,032",ข่าวบันเทิง_1459.txt,ข่าวบันเทิง
"เตียงหักอีกคู่! ""ตุ้ย ธีรภัทร์"" เซ็นใบหย่า ""แอนนา นาตาชา"" แล้ว",https://www.sanook.com/news/7881826/,30-ส.ค.-62,"258,977",ข่าวบันเทิง_1460.txt,ข่าวบันเทิง
ภาพงานแต่งงาน นิหน่า-แบงค์ หวานที่สุด!!!,https://www.sanook.com/news/993547/,8-ม.ค.-54,"258,846",ข่าวบันเทิง_1461.txt,ข่าวบันเทิง
ธีมทองสุดหรู! ซุป’ตาร์ขอใส่ท้าประชันพรมแดง,https://www.sanook.com/news/1741919/,3-ก.พ.-58,"258,764",ข่าวบันเทิง_1462.txt,ข่าวบันเทิง
โจรบุกบ้านหวังข่มขืน พรีม กัญณภัทร ดาราค่ายดัง,https://www.sanook.com/news/1491569/,25-ก.พ.-57,"258,745",ข่าวบันเทิง_1463.txt,ข่าวบันเทิง
กิ่ง ภัทรา ทิวานนท์ นางฟ้าในตำนานในวัย 52 ปี ยังเป๊ะมาก,https://www.sanook.com/news/1997354/,18-พ.ค.-59,"258,694",ข่าวบันเทิง_1464.txt,ข่าวบันเทิง
"""ไอซ์ ปรีชญา"" ถูกชาวเน็ตบูลลี่หน้าตา ยืนยันคำเดิม ไม่ได้ทำอะไรเพิ่ม หน้าไม่ได้เปลี่ยน",https://www.sanook.com/news/8025734/,5-ก.พ.-63,"258,581",ข่าวบันเทิง_1465.txt,ข่าวบันเทิง
โบว์ แวนดา ไขข้อสงสัยเท้าปริศนา เชื่อ ปอ ทฤษฎี ยังอยู่ข้างๆ,https://www.sanook.com/news/1957171/,29 ก.พ. 59,"258,550",ข่าวบันเทิง_1466.txt,ข่าวบันเทิง
ใบเตย งานเข้า! มือมืดโพสต์ภาพใส่บรากอดหนุ่ม,https://www.sanook.com/news/1168179/,4-ก.พ.-56,"258,341",ข่าวบันเทิง_1467.txt,ข่าวบันเทิง
ช็อตเด็ด!! พระ นาง เล่นจริง จูบจริง เห็นกันจะจะ,https://www.sanook.com/news/970541/,5-พ.ย.-53,"258,333",ข่าวบันเทิง_1468.txt,ข่าวบันเทิง
"""ดีเจต้นหอม"" เขินหนักโพสต์รูปใส่บิกินี่ ดาราตัวแม่เข้ามาคอมเมนต์",https://www.sanook.com/news/8498058/,4-ม.ค.-65,"258,292",ข่าวบันเทิง_1469.txt,ข่าวบันเทิง
แป๋ว ไนน์เอ็นเตอร์เทน ยอมรับคลิปหลุดจริง,https://www.sanook.com/news/1108255/,29-มี.ค.-55,"258,257",ข่าวบันเทิง_1470.txt,ข่าวบันเทิง
"ส่องบ้านฟ้าเคียงตะวัน สุดโรแมนติกของคู่รัก ""ยุ้ย ธัญญ์""",https://www.sanook.com/news/2014539/,18-มิ.ย.-59,"258,106",ข่าวบันเทิง_1471.txt,ข่าวบันเทิง
โอ วรุฒ ทำเซอร์ไพรส์!! มีลูกชายอายุ 15,https://www.sanook.com/news/987005/,8-ธ.ค.-53,"257,961",ข่าวบันเทิง_1472.txt,ข่าวบันเทิง
"""ศิริพร อำไพพงษ์"" ถูกลอตเตอรี่ชุดใหญ่หลายแสน เฮงจริงๆ งวด 1 ส.ค.",https://www.sanook.com/news/7852874/,1-ส.ค.-62,"257,951",ข่าวบันเทิง_1473.txt,ข่าวบันเทิง
