Title,Link,Date,Views,File_name,Label
"""โบว์ แวนดา"" เผยพินัยกรรมของ ""ปอ ทฤษฎี"" ที่ไม่ทำตามจะโดนยึดทรัพย์สินคืนทั้งหมด",https://www.sanook.com/news/8285895/,30-ต.ค.-63,"404,860",ข่าวบันเทิง_439.txt,ข่าวบันเทิง
ภาพซึ้ง น้ำฝน กุณณัฏฐ์ พาแฟนฝรั่งสู่ขอแม่กำลังป่วย,https://www.sanook.com/news/1785890/,25-เม.ย.-58,"404,795",ข่าวบันเทิง_440.txt,ข่าวบันเทิง
ดอม เปล่งพานิช ลูกชายนก สินจัย แต่งงานแล้ว,https://www.sanook.com/news/1430932/,27-ม.ค.-57,"404,795",ข่าวบันเทิง_441.txt,ข่าวบันเทิง
"""ใหม่ ดาวิกา"" ไลก์ทะลุล้าน เล่าฟีดแบก ""เต๋อ"" เห็นนุ่งบิกินี่ตัวจิ๋ว หวงมากแต่ก็เก็บอาการ",https://www.sanook.com/news/8296122/,14-พ.ย.-63,"404,376",ข่าวบันเทิง_442.txt,ข่าวบันเทิง
"""นุ๊ก สุทธิดา"" เปิดตัวลูกชายสุดหล่อ เผยลูกๆ ได้เจอพ่อแท้ๆ อีกครั้ง",https://www.sanook.com/news/7865446/,14-ส.ค.-62,"404,052",ข่าวบันเทิง_443.txt,ข่าวบันเทิง
ป๋อ เอ๋ ย้ายเข้าบ้านหลังใหม่แล้ว อลังการ วิวสวยมาก,https://www.sanook.com/news/2042710/,5-ส.ค.-59,"404,043",ข่าวบันเทิง_444.txt,ข่าวบันเทิง
กระต่าย แม็กซิม(Maxim) โชว์อกตูม มีแค่สายเอี๊ยมปิด,https://www.sanook.com/news/1717261/,18-ธ.ค.-57,"404,014",ข่าวบันเทิง_445.txt,ข่าวบันเทิง
เปิดบ้านหรูคฤหาสถ์กว่าสิบล้านของคนดัง,https://www.sanook.com/news/1658727/,30-ส.ค.-57,"403,986",ข่าวบันเทิง_446.txt,ข่าวบันเทิง
"""เคน ธีรเดช"" รายได้มาเอง 10 ปีก่อน ซื้อบ้านในญี่ปุ่นถูกมองว่าบ้า แต่ตอนนี้กลายเป็นที่สุดฮิต",https://www.sanook.com/news/7953878/,16-พ.ย.-62,"403,953",ข่าวบันเทิง_447.txt,ข่าวบันเทิง
"""ปิ่น เก็จมณี"" มองข้ามดราม่า พูดถึง ""เจ้าขุน"" ในมุมของคนเป็นแม่",https://www.sanook.com/news/7863950/,13-ส.ค.-62,"403,870",ข่าวบันเทิง_448.txt,ข่าวบันเทิง
"""ศรราม"" จัดหนักโพสต์คลิปถึง ""ติ๊ก"" อดีตภรรยา ""รักลูก รักสามีมันเป็นแบบนี้เหรอครับ""",https://www.sanook.com/news/8245990/,4-ก.ย.-63,"403,747",ข่าวบันเทิง_449.txt,ข่าวบันเทิง
"""ปู ไปรยา"" สวมทูพีซจิ๋วเริงร่าท้าลมทะเล หุ่นเป๊ะ แซ่บตาแตก",https://www.sanook.com/news/8301418/,22-พ.ย.-63,"403,002",ข่าวบันเทิง_450.txt,ข่าวบันเทิง
"หุ่นเข้าที่เร็วมาก ""จีน่า"" ภรรยาเด็ก โอ๊ต วรวุฒิ น้ำหนักแค่ 39",https://www.sanook.com/news/2188966/,24-มี.ค.-60,"402,956",ข่าวบันเทิง_451.txt,ข่าวบันเทิง
ปู ไปรยา ขนลุก!! โชว์สยิวนายแบบเปลือยต่อหน้า,https://www.sanook.com/news/1769113/,24-มี.ค.-58,"402,445",ข่าวบันเทิง_452.txt,ข่าวบันเทิง
แพท ณปภา เผยไม่รู้ สามีซื้อรถ 20 ล้านเงินสด เปิดใจหลัง โตโน่ ระบุไม่ใช่คนสนิท,https://www.sanook.com/news/2077355/,3-ต.ค.-59,"402,140",ข่าวบันเทิง_453.txt,ข่าวบันเทิง
"""ไอซ์ อภิษฎา"" อดแซวไม่ได้ แฟนหนุ่มเปลือยท่อนบน เผยให้เห็นรอยสักทั่วร่างกาย",https://www.sanook.com/news/7974722/,8-ธ.ค.-62,"401,315",ข่าวบันเทิง_454.txt,ข่าวบันเทิง
"""หนิง ปณิตา"" จุกคำพูด ""ทราย เจริญปุระ"" นั่งมองพวงหรีด บอกไม่คิดว่าตัวเองก็มีเพื่อน",https://www.sanook.com/news/7917006/,7-ต.ค.-62,"400,984",ข่าวบันเทิง_455.txt,ข่าวบันเทิง
เริ่มแล้วงานหมั้นอลังการ แองจี้ เฮสติ้ง สวยหวานมาก,https://www.sanook.com/news/1871654/,25-ก.ย.-58,"400,943",ข่าวบันเทิง_456.txt,ข่าวบันเทิง
"""ตงตง"" โผล่แซวความเซ็กซี่ ""ลำไย ไหทองคำ"" แฟนๆ ถาม ""เบสท์"" ว่ายังไง?",https://www.sanook.com/news/8393370/,7-มิ.ย.-64,"400,755",ข่าวบันเทิง_457.txt,ข่าวบันเทิง
ดีเจต้นหอม ทำจริง! ทาหน้าขาวแต่งชุดไทยง้อ แทค ภรัณยู,https://www.sanook.com/news/1614377/,18-มิ.ย.-57,"400,710",ข่าวบันเทิง_458.txt,ข่าวบันเทิง
"ชาวเน็ตขุดต่อ ""ชิงชิง"" คอมเมนต์อิโมจิรูปคู่ ""เวียร์-เบลล่า""",https://www.sanook.com/news/7889838/,8-ก.ย.-62,"399,236",ข่าวบันเทิง_459.txt,ข่าวบันเทิง
"น้ำหนึ่ง ณมน เจ้าของประโยค ""ชิดกว่าชมอีก"" เสียชีวิตด้วยโรคมะเร็ง",https://www.sanook.com/news/1196548/,11-ก.ค.-56,"399,195",ข่าวบันเทิง_460.txt,ข่าวบันเทิง
แตงโม ท้อง! หลังโพสต์ในอินสตราแกรม ดีใจจะมีตัวน้อย,https://www.sanook.com/news/1177752/,1-เม.ย.-56,"398,792",ข่าวบันเทิง_461.txt,ข่าวบันเทิง
วิวาห์ร้อยล้าน!! ดอน ธีระธาดา ควงคู่หมั้น ประกาศแต่ง,https://www.sanook.com/news/1716701/,17-ธ.ค.-57,"398,706",ข่าวบันเทิง_462.txt,ข่าวบันเทิง
"แบงค์ ซีควินท์ ตัดพ้อ! ""ผมทำอะไรผิด"" หลังภาพอ้วนฉุว่อนเน็ต",https://www.sanook.com/news/1740241/,30-ม.ค.-58,"398,327",ข่าวบันเทิง_463.txt,ข่าวบันเทิง
พวงหรีดจากใจคนบันเทิง ด้วยรักและอาลัย ปอ ทฤษฎี,https://www.sanook.com/news/1934650/,20-ม.ค.-59,"398,046",ข่าวบันเทิง_464.txt,ข่าวบันเทิง
ชาวเน็ตย้อนดูคลิป พ่อขวัญ อุษามณี คำพูดถึงลูกสาวทั้ง 2,https://www.sanook.com/news/2080930/,10-ต.ค.-59,"397,524",ข่าวบันเทิง_465.txt,ข่าวบันเทิง
"""จุ้มจิ้ม"" ภรรยาคนสวย ""ภัทร จึงกานต์กุล"" ประกาศข่าวดีตั้งท้องลูกแฝด",https://www.sanook.com/news/8385362/,21-พ.ค.-64,"397,225",ข่าวบันเทิง_466.txt,ข่าวบันเทิง
ใหม่ ดาวิกา โดนขุดภาพอดีต หน้าเปลี่ยนเกือบจำไม่ได้,https://www.sanook.com/news/1886798/,22-ต.ค.-58,"397,033",ข่าวบันเทิง_467.txt,ข่าวบันเทิง
"สุดเศร้า ""อ๊อด คีรีบูน"" เสียชีวิตแล้ว ช็อกแฟนเพลงยุค 80",https://www.sanook.com/news/8459154/,17-ต.ค.-64,"396,692",ข่าวบันเทิง_468.txt,ข่าวบันเทิง
แองจี้ ห่มทอง! แถลงแต่งเศรษฐีน้ำมันอลังการที่สุด,https://www.sanook.com/news/1872626/,27-ก.ย.-58,"396,312",ข่าวบันเทิง_469.txt,ข่าวบันเทิง
ไก่ มีสุข ปิดเฟซบุ๊กหลังคลิป น้องนามรูป ถูกด่ายับ,https://www.sanook.com/news/1637965/,28-ก.ค.-57,"395,951",ข่าวบันเทิง_470.txt,ข่าวบันเทิง
ยลโฉมลูกสาวแอฟ ทักษอร เพื่อนดาราแห่รับขวัญหลาน,https://www.sanook.com/news/1724849/,3-ม.ค.-58,"395,947",ข่าวบันเทิง_471.txt,ข่าวบันเทิง
แอน มิตรชัย เปิดตัวอุปการะลูกบุญธรรม กระเตงเที่ยวทะเล,https://www.sanook.com/news/1802314/,27-พ.ค.-58,"395,784",ข่าวบันเทิง_472.txt,ข่าวบันเทิง
"พ่อเจปลื้ม ""น้องเจด้า"" ลูกสาวคนสวย เข้ามหาวิทยาลัยชื่อดัง",https://www.sanook.com/news/1989442/,3-พ.ค.-59,"395,735",ข่าวบันเทิง_473.txt,ข่าวบันเทิง
"เจี๊ยบ โสภิตนภา เจอแฉ ชีวิตจริงเหมือน ""นางร้าย"" มากกว่านางเอก",https://www.sanook.com/news/1944018/,5-ก.พ.-59,"394,897",ข่าวบันเทิง_474.txt,ข่าวบันเทิง
ไก่ มีสุข พบเลือดออกถุงมดลูก หมอให้ยากันแท้ง,https://www.sanook.com/news/1204046/,20-ส.ค.-56,"394,432",ข่าวบันเทิง_475.txt,ข่าวบันเทิง
"""เวียร์ ศุกลวัฒน์"" เปิดใจรักครั้งใหม่? ตอบตรงไม่มีกั๊ก ประเด็นภาพแอบถ่ายร่วมเฟรมสาวหมวย",https://www.sanook.com/news/8516470/,10-ก.พ.-65,"392,780",ข่าวบันเทิง_476.txt,ข่าวบันเทิง
ตุ๊กกี้ ชิงร้อยฯ เปิดคฤหาสถ์หรูทำบุญขึ้นบ้านใหม่,https://www.sanook.com/news/1262896/,10-ต.ค.-56,"392,546",ข่าวบันเทิง_477.txt,ข่าวบันเทิง
มายด์ มาธวี วัฒนกุล เสียชีวิต พี่สาวเขียนบทอาลัยถึง,https://www.sanook.com/news/1135264/,9-ส.ค.-55,"392,282",ข่าวบันเทิง_478.txt,ข่าวบันเทิง
ช็อคอีกรอบ!! พิธีกรร่วม โพสต์ลาออกเรื่องเล่าเช้านี้,https://www.sanook.com/news/1976066/,7-เม.ย.-59,"392,086",ข่าวบันเทิง_479.txt,ข่าวบันเทิง
"ชาวเน็ตตกใจ หลังภาพหลุด ""นิว วงศกร"" ถูกตำรวจจับกุม",https://www.sanook.com/news/1956302/,28-ก.พ.-59,"391,999",ข่าวบันเทิง_480.txt,ข่าวบันเทิง
"แซ่บเวอร์ ""เกรซ กาญจน์เกล้า"" ใส่บิกินี่ตัวจิ๋ว ท่อนบนท่อนล่างขาวไปหมด",https://www.sanook.com/news/8473654/,15-พ.ย.-64,"391,932",ข่าวบันเทิง_481.txt,ข่าวบันเทิง
ฉุน! แอ๊ด คาราบาว ทุ่มกีตาร์กลางงานสีสันอวอร์ดส์,https://www.sanook.com/news/1010814/,24-มี.ค.-54,"391,896",ข่าวบันเทิง_482.txt,ข่าวบันเทิง
ปุ๊ปปั๊บรับโชค! 6 คุณแม่คนดัง ตั้งท้องสมใจ,https://www.sanook.com/news/2069334/,19-ก.ย.-59,"391,707",ข่าวบันเทิง_483.txt,ข่าวบันเทิง
"""นุ่น วรนุช"" โชว์ชัดๆ หน้าสดที่สุดในชีวิต แต่ดันถูกแย่งโฟกัส เพราะความแซ่บของเสื้อ",https://www.sanook.com/news/8474794/,17-พ.ย.-64,"391,650",ข่าวบันเทิง_484.txt,ข่าวบันเทิง
ตั๊ก มยุรา เมิน!! ถูกชาวเน็ตจวกแรง ซื้อรถให้ลูก,https://www.sanook.com/news/1864006/,11-ก.ย.-58,"391,638",ข่าวบันเทิง_485.txt,ข่าวบันเทิง
โย ปราณวรินทร์ ดาราช่อง 7 สุดซึ้ง! ทายาทโรงแรมเชอราตัน ขอแต่งงาน,https://www.sanook.com/news/2056254/,27-ส.ค.-59,"391,610",ข่าวบันเทิง_486.txt,ข่าวบันเทิง
ส่องลูกชาย เอส วรฤทธิ์ ยิ่งโตยิ่งฉายแววหล่อเหมือนพ่อ,https://www.sanook.com/news/2201354/,17-เม.ย.-60,"391,540",ข่าวบันเทิง_487.txt,ข่าวบันเทิง
5 งานแต่งดารา เพื่อนเจ้าสาวเก๋ๆ ไม่ซ้ำใคร,https://www.sanook.com/news/1771013/,27-มี.ค.-58,"391,262",ข่าวบันเทิง_488.txt,ข่าวบันเทิง
ดราม่า!! อั้ม เปิดใจ ปุ๊กลุก ชุดซ้ำหวังเทียบรัศมี ?,https://www.sanook.com/news/1762610/,12-มี.ค.-58,"390,246",ข่าวบันเทิง_489.txt,ข่าวบันเทิง
รายงานสดจากโรงพยาบาลอาการ ปอ ทฤษฎี วันที่ 19 พฤศจิกายน,https://www.sanook.com/news/1901926/,19-พ.ย.-58,"390,035",ข่าวบันเทิง_490.txt,ข่าวบันเทิง
"""ดีเจเพชรจ้า"" ขอพูดบ้าง หลังถูกวิเคราะห์สาเหตุเลิก ""นิวเคลียร์""",https://www.sanook.com/news/8428246/,17-ส.ค.-64,"390,008",ข่าวบันเทิง_491.txt,ข่าวบันเทิง
"""ดาว ขำมิน"" เคลียร์ปม ""หยวน นิธิชัย"" พูดไม่ให้เกียรติกลางรายการ",https://www.sanook.com/news/1884634/,18-ต.ค.-58,"389,874",ข่าวบันเทิง_492.txt,ข่าวบันเทิง
บรรยากาศงานศพ ปอ ทฤษฎี ที่วัดกลางพระอารามหลวง จ.บุรีรัมย์,https://www.sanook.com/news/1933934/,19-ม.ค.-59,"389,719",ข่าวบันเทิง_493.txt,ข่าวบันเทิง
ไม่โสดแต่แซ่บ! บัว สโรชา ในชุดบิกินี่,https://www.sanook.com/news/1203753/,19-ส.ค.-56,"389,460",ข่าวบันเทิง_494.txt,ข่าวบันเทิง
"""ซูโม่กิ๊ก"" โพสต์ เงียบไม่ได้แปลว่าไม่รู้สึก ชาวโซเชียลถกเถียงฉะกันเดือด",https://www.sanook.com/news/8275530/,16-ต.ค.-63,"389,169",ข่าวบันเทิง_495.txt,ข่าวบันเทิง
"จูน แม็กซิม สวย..สะพรึง! ""ชุดเทปกาว"" กลางงาน Siamdara Stars Awards 2016",https://www.sanook.com/news/2021770/,30-มิ.ย.-59,"388,964",ข่าวบันเทิง_496.txt,ข่าวบันเทิง
"""ดิว อริสรา"" หวานไม่แผ่ว ควง ""เซบาสเตียน"" เที่ยวทะเลเกาะสมุย",https://www.sanook.com/news/8395106/,10-มิ.ย.-64,"388,814",ข่าวบันเทิง_497.txt,ข่าวบันเทิง
เปิดบ้านดารา สวยน่าอยู่มาก ๆ,https://www.sanook.com/news/1017731/,22-เม.ย.-54,"388,750",ข่าวบันเทิง_498.txt,ข่าวบันเทิง
ต้อง ศุภัชญา ร่ำไห้น้ำตาอาบแก้ม ไร้เงา ดร.เอก เซ็นใบหย่าตามนัด,https://www.sanook.com/news/2063770/,9-ก.ย.-59,"387,916",ข่าวบันเทิง_499.txt,ข่าวบันเทิง
หญิง กิติยา ดาวกระจาย โต้ข่าวนอนกับบอย ปกรณ์,https://www.sanook.com/news/1307355/,7-พ.ย.-56,"387,749",ข่าวบันเทิง_500.txt,ข่าวบันเทิง
"ประมวลภาพ พิธีพระราชทานเพลิงศพ ""แม่ทุม ปทุมวดี"" บรรยากาศเต็มไปด้วยความโศกเศร้า",https://www.sanook.com/news/8251634/,13-ก.ย.-63,"387,573",ข่าวบันเทิง_501.txt,ข่าวบันเทิง
ชาวเน็ตแห่วิจารณ์รูปพวงหรีดแตงโมหันออกงานศพสิงห์,https://www.sanook.com/news/1840911/,3-ส.ค.-58,"387,548",ข่าวบันเทิง_502.txt,ข่าวบันเทิง
"เช็คกระแสคนบันเทิง ข่าว ""เจนี่ เอ๋ ชนม์สวัสดิ์""",https://www.sanook.com/news/1201830/,8-ส.ค.-56,"386,589",ข่าวบันเทิง_503.txt,ข่าวบันเทิง
คลิปหลุด หน้าคล้ายนางเอกสาวบรรเลงเพลงรักสุดฟิน,https://www.sanook.com/news/1645361/,8-ส.ค.-57,"386,263",ข่าวบันเทิง_504.txt,ข่าวบันเทิง
"เปิดภาพครอบครัว ""แอฟ ทักษอร"" สวยหล่อกันทั้งตระกูล",https://www.sanook.com/news/2169358/,15-ก.พ.-60,"386,181",ข่าวบันเทิง_505.txt,ข่าวบันเทิง
เปิดประวัติ ผู้กองหมี แฟนหนุ่มนางเอก แพนเค้ก,https://www.sanook.com/news/1162742/,7-ม.ค.-56,"386,076",ข่าวบันเทิง_506.txt,ข่าวบันเทิง
"""เปิ้ล นาคร"" เปิดใจดราม่าลูกย้ายโรงเรียนเพราะติดหรู ค่าเทอมแพงปีละ 4 ล้าน",https://www.sanook.com/news/7874202/,23-ส.ค.-62,"385,899",ข่าวบันเทิง_507.txt,ข่าวบันเทิง
อื้อหือ! นาตาลี เกลโบวา สลัดผ้าขึ้นปก PLAYBOY,https://www.sanook.com/news/1752149/,21-ก.พ.-58,"385,895",ข่าวบันเทิง_508.txt,ข่าวบันเทิง
"""หญิง รฐา"" เข้าพิธีหมั้นแล้ว จัดงานเรียบง่ายแต่หรูหรา อบอวลด้วยความรัก",https://www.sanook.com/news/8386998/,25-พ.ค.-64,"385,741",ข่าวบันเทิง_509.txt,ข่าวบันเทิง
"เอ็นดูมาก ""ปุ้มปุ้ย"" อุ้มท้องนั่งร้องไห้ หิวแค่ไหนแต่ก็ต้องอดทน",https://www.sanook.com/news/8486738/,10-ธ.ค.-64,"385,637",ข่าวบันเทิง_510.txt,ข่าวบันเทิง
โฟกัส จีระกุล ลงคลิประบาย ฝากถึง..พระเอกคนหนึ่ง?,https://www.sanook.com/news/1507412/,10-มี.ค.-57,"385,295",ข่าวบันเทิง_511.txt,ข่าวบันเทิง
เหตุผลที่ วิลลี่ ปลด เปิ้ล นาคร ออกจากสาระแน,https://www.sanook.com/news/1143252/,19-ก.ย.-55,"385,190",ข่าวบันเทิง_512.txt,ข่าวบันเทิง
งานล่ม! ไม่เป็นท่า บอย ปกรณ์ โดนด่ากลางอนุสาวรีย์,https://www.sanook.com/news/1175113/,18-มี.ค.-56,"384,922",ข่าวบันเทิง_513.txt,ข่าวบันเทิง
"เปิดบ้านบนดอยของ ""ริชชี่"" นางเอกซ่อนเงารัก ไร่ชาและโฮมสเตย์น่าอยู่มาก",https://www.sanook.com/news/8027774/,7-ก.พ.-63,"384,886",ข่าวบันเทิง_514.txt,ข่าวบันเทิง
วับๆ แวมๆ รวมมิตรดาราขอเซ็กซี่ซีทรู,https://www.sanook.com/news/1804299/,30-พ.ค.-58,"384,786",ข่าวบันเทิง_515.txt,ข่าวบันเทิง
เมย์ พิชญ์นาฏ เคารพศพแม่เล็ก ให้กำลังใจตั๊ก บงกช,https://www.sanook.com/news/2202054/,18-เม.ย.-60,"384,717",ข่าวบันเทิง_516.txt,ข่าวบันเทิง
ภาพเต็ม พรีเวดดิ้ง ชมพู่ อารยา อลังการเลอค่า,https://www.sanook.com/news/1774682/,3-เม.ย.-58,"384,675",ข่าวบันเทิง_517.txt,ข่าวบันเทิง
ปุ๊บปั๊บทันใจ!! คุณแม่สุดสตรองอุ้มท้องเข้าสู่ประตูวิวาห์,https://www.sanook.com/news/2072643/,24-ก.ย.-59,"384,560",ข่าวบันเทิง_518.txt,ข่าวบันเทิง
รู้จัก จิน ธรรมวัฒนะ ทายาทขุมทรัพย์หมื่นล้าน!,https://www.sanook.com/news/1028479/,6-มิ.ย.-54,"384,475",ข่าวบันเทิง_519.txt,ข่าวบันเทิง
"เผยภาพพรีเวดดิ้งสุดเซ็กซี่ ""แพง ขวัญข้าว"" แต่งงานเสาร์นี้",https://www.sanook.com/news/2150650/,11-ม.ค.-60,"384,259",ข่าวบันเทิง_520.txt,ข่าวบันเทิง
สยิว! ลูกตาล หลุดคาเตียง ถ่ายอวดหุ่นเซี๊ยะไม่มีรีทัช,https://www.sanook.com/news/1801478/,25-พ.ค.-58,"384,089",ข่าวบันเทิง_521.txt,ข่าวบันเทิง
ขวัญ อุษามณี แหวกล่างไม่หนำใจ ขออวดบนโชว์แซ่บ,https://www.sanook.com/news/1820359/,28-มิ.ย.-58,"383,947",ข่าวบันเทิง_522.txt,ข่าวบันเทิง
ชัดเจน “ลูกจัน จันทร์จิรา” เคลียร์เลิก “ติ๊ก กลิ่นสี” ก่อนแต่งงาน!!,https://www.sanook.com/news/1198763/,23-ก.ค.-56,"383,615",ข่าวบันเทิง_523.txt,ข่าวบันเทิง
ซัน ประชากร เปิดปากเล่า! ผมอยู่ในเหตุดราม่าของพี่หนูแหม่ม,https://www.sanook.com/news/2236022/,22-พ.ค.-60,"383,582",ข่าวบันเทิง_524.txt,ข่าวบันเทิง
ชัดเจน! เกรซ เปิดใจ เหตุสะบั้นรัก ก้อง กรุณ,https://www.sanook.com/news/1730417/,13-ม.ค.-58,"383,516",ข่าวบันเทิง_525.txt,ข่าวบันเทิง
