Title,Link,Date,Views,File_name,Label
อ้วน โต้ควง แจม เที่ยว 2 ต่อ 2 กั๊กเรียกแฟน,https://www.sanook.com/news/1192064/,17-มิ.ย.-56,"84,120,862",ข่าวบันเทิง_1.txt,ข่าวบันเทิง
เผยเบื้องลึก แตงโม กินยานอนหลับ หวังฆ่าตัวตาย,https://www.sanook.com/news/1824931/,6-ก.ค.-58,"2,080,594",ข่าวบันเทิง_2.txt,ข่าวบันเทิง
อิม น้ำตานอง! เลิกหนุ่มคนรัก เจอความจริงที่รับไม่ได้,https://www.sanook.com/news/1783638/,21-เม.ย.-58,"1,944,355",ข่าวบันเทิง_3.txt,ข่าวบันเทิง
"ต้องฟังจากปาก ""โตโน่"" สาเหตุแยกทาง ""แตงโม"" จนถึงขั้นฆ่าตัวตาย",https://www.sanook.com/news/1825475/,7-ก.ค.-58,"1,867,870",ข่าวบันเทิง_4.txt,ข่าวบันเทิง
วันนี้ที่รอคอย ฟิล์ม ยิ้มออก แอนนี่ รับแล้วไม่ใช่พ่อของลูก!!,https://www.sanook.com/news/1153924/,16-พ.ย.-55,"1,867,170",ข่าวบันเทิง_5.txt,ข่าวบันเทิง
โจอี้ บอย โต้อาจารย์ดังบอก ซิโก้ พูดภาษาอังกฤษเหมือนเมียเช่าฝรั่ง,https://www.sanook.com/news/1719217/,22-ธ.ค.-57,"1,691,970",ข่าวบันเทิง_6.txt,ข่าวบันเทิง
"""โตโน่ ภาคิน"" แถลงปมเหตุแยกทาง “แตงโม“",https://www.sanook.com/news/1826199/,8-ก.ค.-58,"1,610,950",ข่าวบันเทิง_7.txt,ข่าวบันเทิง
"โพสต์สุดท้ายของ โบว์ แวนด้า ก่อน ""ปอ ทฤษฎี"" เสียชีวิต",https://www.sanook.com/news/1933346/,18-ม.ค.-59,"1,540,070",ข่าวบันเทิง_8.txt,ข่าวบันเทิง
"""กระแต"" ฟาดด้วยคลิป ถูกวิจารณ์เพลง แทบจะแก้ผ้า ขายเสียงหรือขายอะไร?",https://www.sanook.com/news/8513906/,5-ก.พ.-65,"1,519,527",ข่าวบันเทิง_9.txt,ข่าวบันเทิง
น้องมะลิ ร้องไห้หนักมาก หลังไม่มีใครเล่นซนด้วย,https://www.sanook.com/news/1935490/,21-ม.ค.-59,"1,339,381",ข่าวบันเทิง_10.txt,ข่าวบันเทิง
กัญจน์ ลูกชาย ฉลอง ภักดีวิจิตร โพสต์ความรู้สึกหลังพ่อแต่งงาน,https://www.sanook.com/news/1722483/,29-ธ.ค.-57,"1,304,407",ข่าวบันเทิง_11.txt,ข่าวบันเทิง
"บุรีรัมย์เห็นทั้งเมือง ลือสาว (แอบ) สนิท ""ปีเตอร์"" อยู่ที่นี่",https://www.sanook.com/news/1829046/,13-ก.ค.-58,"1,223,143",ข่าวบันเทิง_12.txt,ข่าวบันเทิง
"ก้อง สหรัถ รับสาวในรูปทริปไปญี่ปุ่นคือ ""แฟน"" ฟุ้งคบกันนาน 20 ปี",https://www.sanook.com/news/1820343/,28-มิ.ย.-58,"1,197,870",ข่าวบันเทิง_13.txt,ข่าวบันเทิง
รายงานสด แตงโม ภัทรธิดา แถลงข่าวปมกินยาฆ่าตัวตาย,https://www.sanook.com/news/1825443/,7-ก.ค.-58,"1,188,747",ข่าวบันเทิง_14.txt,ข่าวบันเทิง
"น้ำตาไหล...น้องมะลิ กราบพ่อปอครั้งสุดท้าย ชูมือบอก ""พ่อสู้ๆ""",https://www.sanook.com/news/1933718/,19-ม.ค.-59,"1,183,376",ข่าวบันเทิง_15.txt,ข่าวบันเทิง
"ลูกสาวอิทธิ พลางกูร เผย ไม่ลืมคำที่ ""กี้ร์ อริสมันต์"" พูดกับครอบครัว",https://www.sanook.com/news/2092270/,29-ต.ค.-59,"1,155,343",ข่าวบันเทิง_16.txt,ข่าวบันเทิง
กรี๊ดลั่น! ชมพู่ อารยา ปลื้ม น็อตคุกเข่าขอแต่งงานแล้ว,https://www.sanook.com/news/1719853/,23-ธ.ค.-57,"1,071,732",ข่าวบันเทิง_17.txt,ข่าวบันเทิง
"ถอดทุกคำพูด ""แทค ภรัณยู"" ให้สัมภาษณ์ก่อนประกาศเลิกเมีย ช็อกทั้งวงการ",https://www.sanook.com/news/7892118/,10-ก.ย.-62,"1,065,299",ข่าวบันเทิง_18.txt,ข่าวบันเทิง
รายงานสด เจนี่ เอ๋ แถลงข่าวความสัมพันธ์,https://www.sanook.com/news/1201810/,8-ส.ค.-56,"1,065,040",ข่าวบันเทิง_19.txt,ข่าวบันเทิง
ภาพอบอุ่น เสี่ยตา ปัญญา ส่งลูกสาวคนสวย เข้าสู่ประตูวิวาห์,https://www.sanook.com/news/1921326/,27-ธ.ค.-58,"1,040,949",ข่าวบันเทิง_20.txt,ข่าวบันเทิง
ภาพหลุดดาราสะท้านวงการ,https://www.sanook.com/news/1307073/,6-พ.ย.-56,"1,027,661",ข่าวบันเทิง_21.txt,ข่าวบันเทิง
"""แพท ณปภา"" ร่ำไห้เผย 30 ปี ไม่เคยเจอแม่ที่แท้จริง เพิ่งรู้ ""พ่อ"" คือคนที่เรียกว่า ""พี่"" มาตลอด",https://www.sanook.com/news/7177734/,14-ก.ค.-61,"1,007,512",ข่าวบันเทิง_22.txt,ข่าวบันเทิง
"หมอโอ๊ค เสียน้ำตา อัพเดทอาการ ""โอปอล์"" ตั้งครรภ์ลูกฝาแฝดผิดปกติ",https://www.sanook.com/news/1862150/,8-ก.ย.-58,"988,276",ข่าวบันเทิง_23.txt,ข่าวบันเทิง
ตั๊ก บงกช เซ็งหนัก ภาพหลุดแอบถ่ายทริปเรือยอร์ช,https://www.sanook.com/news/1815595/,20-มิ.ย.-58,"973,389",ข่าวบันเทิง_24.txt,ข่าวบันเทิง
ท็อป ดารณีนุช เปิดใจปมหย่าสามี จบชีวิตรัก 22 ปี,https://www.sanook.com/news/1753753/,24-ก.พ.-58,"973,226",ข่าวบันเทิง_25.txt,ข่าวบันเทิง
โฉมหน้าซุป'ตาร์ เก่งทั้งในและนอกจอ,https://www.sanook.com/news/1751807/,20-ก.พ.-58,"972,755",ข่าวบันเทิง_26.txt,ข่าวบันเทิง
"หนังคนละม้วน ""ต้นหอม"" เปิดใจเลิก ""แทค"" เพราะเรื่องผู้หญิง",https://www.sanook.com/news/1817266/,23-มิ.ย.-58,"965,622",ข่าวบันเทิง_27.txt,ข่าวบันเทิง
"เปิดตัว ""น้องมะลิ"" วัย 2 ขวบ ปอ -โบว์ จดทะเบียนสมรสแล้ว",https://www.sanook.com/news/1898954/,13-พ.ย.-58,"941,680",ข่าวบันเทิง_28.txt,ข่าวบันเทิง
บี้ โผล่เซอร์ไพรส์ กุ๊บกิ๊บ สวีทจนน้ำทะเลหวาน,https://www.sanook.com/news/1790670/,4-พ.ค.-58,"941,132",ข่าวบันเทิง_29.txt,ข่าวบันเทิง
สะพัด! แตงโม ฆ่าตัวตาย โยงปม โตโน่ ประกาศโสด,https://www.sanook.com/news/1824918/,6-ก.ค.-58,"938,959",ข่าวบันเทิง_30.txt,ข่าวบันเทิง
จับตา!! สถานะ “โตโน่ เกรซ” ยังไงกันแน่ ?,https://www.sanook.com/news/1833106/,20-ก.ค.-58,"927,527",ข่าวบันเทิง_31.txt,ข่าวบันเทิง
"""เป้ ทวีฤทธิ์"" จากพระเอกสู่เด็กเสิร์ฟ ขายสมบัติประทังชีวิตเลี้ยงภรรยาพร้อมลูกติด",https://www.sanook.com/news/7892374/,11-ก.ย.-62,"909,214",ข่าวบันเทิง_32.txt,ข่าวบันเทิง
นิกกี้ 9 นิ้ว ฉะแหลก นางเอก AV ขอถอนตัว,https://www.sanook.com/news/1752873/,23-ก.พ.-58,"905,843",ข่าวบันเทิง_33.txt,ข่าวบันเทิง
"โพสต์แรกจาก ""แตงโม ภัทรธิดา"" หลัง ""โตโน่"" แถลงเลิกแล้ว",https://www.sanook.com/news/1826643/,9-ก.ค.-58,"900,817",ข่าวบันเทิง_34.txt,ข่าวบันเทิง
บอย ปกรณ์ แถลงทั้งน้ำตา ยืดอกยอมรับภาพหลุด,https://www.sanook.com/news/1298838/,4-พ.ย.-56,"869,681",ข่าวบันเทิง_35.txt,ข่าวบันเทิง
"""แคนดี้ รากแก่น"" ร่ายยาว ดราม่า ""เจนนี่-เก้า"" ฟาดจุกๆ คนทั้งวงการเขารู้กันหมดแล้ว",https://www.sanook.com/news/8223690/,5-ส.ค.-63,"868,259",ข่าวบันเทิง_36.txt,ข่าวบันเทิง
"""ผู้กองไอซ์"" ปล่อยภาพแฉ ""มาร์กี้-ป๊อก"" บอกสุดทนแล้วเห็นมาหลายปี",https://www.sanook.com/news/8459938/,18-ต.ค.-64,"856,709",ข่าวบันเทิง_37.txt,ข่าวบันเทิง
หวิดบ้านแตก!! เมียช็อค เมฆ วินัย ถ่ายแฟชั่นสยิว,https://www.sanook.com/news/1823335/,3-ก.ค.-58,"845,415",ข่าวบันเทิง_38.txt,ข่าวบันเทิง
คลิปหลุด! ลือเป็นดาราสาวชื่อดัง อ้อนแฟนให้มีเซ็กส์,https://www.sanook.com/news/1661529/,4-ก.ย.-57,"843,863",ข่าวบันเทิง_39.txt,ข่าวบันเทิง
โอปอล์ ปาณิสรา เปิดโฉม..ภาพแรก อลิน-อรัญ ลูกน้อยฝาแฝด,https://www.sanook.com/news/1883390/,16-ต.ค.-58,"834,428",ข่าวบันเทิง_40.txt,ข่าวบันเทิง
"""นุ๊ก สุทธิดา"" สุดปรี๊ด ประกาศตามหาคนเช่าบ้านแล้วหนี ทำบ้านเละ ค้างค่าไฟห้าหมื่นกว่า",https://www.sanook.com/news/7865986/,15-ส.ค.-62,"826,349",ข่าวบันเทิง_41.txt,ข่าวบันเทิง
เปิดชีวิตสุดหรู ซูซี่ หทัยเทพ ธีระธาดา กับ ภูธฤทธิ์ พรหมบันดาล สามีที่อายุน้อยกว่า 25 ปี,https://www.sanook.com/news/1187552/,24-พ.ค.-56,"815,028",ข่าวบันเทิง_42.txt,ข่าวบันเทิง
โตโน่ เปิดใจข่าวเลิกกัน แตงโม รับแยกบ้านกันอยู่ ย้ำยังรักไม่เปลี่ยน,https://www.sanook.com/news/1798710/,20-พ.ค.-58,"811,613",ข่าวบันเทิง_43.txt,ข่าวบันเทิง
ครีม เปรมสินี ปรี๊ด ถูกวิจารณ์สนุกปาก,https://www.sanook.com/news/1765413/,18-มี.ค.-58,"805,012",ข่าวบันเทิง_44.txt,ข่าวบันเทิง
จำได้ไหม? หนุ่ม ศรราม บี มาติกา 20 ปีผ่านไป,https://www.sanook.com/news/1797006/,17-พ.ค.-58,"804,493",ข่าวบันเทิง_45.txt,ข่าวบันเทิง
"น้ำตาริน ""น้องฉัตร"" แต่งหน้าให้สาวโดนน้ำกรดสาดหน้า กลับมาสวยอีกครั้ง",https://www.sanook.com/news/7497626/,5-ก.ย.-61,"799,099",ข่าวบันเทิง_46.txt,ข่าวบันเทิง
เอ๊ะยังไง? ใหม่ ดาวิกา เป็นลูกครึ่งแต่ภาษาไม่ผ่าน,https://www.sanook.com/news/1770369/,26-มี.ค.-58,"795,993",ข่าวบันเทิง_47.txt,ข่าวบันเทิง
เขาว่าไม่ได้มีแค่รูปแต่มี คลิปบอย ปกรณ์กินตับสาวที่เกาหลี,https://www.sanook.com/news/1299062/,5-พ.ย.-56,"791,339",ข่าวบันเทิง_48.txt,ข่าวบันเทิง
"เปิดใจคนจัดดอกไม้หน้าหีบศพ ""ปอ ทฤษฎี"" โบว์ ซึ้งกลั้นน้ำตาไม่อยู่",https://www.sanook.com/news/1936030/,22-ม.ค.-59,"787,029",ข่าวบันเทิง_49.txt,ข่าวบันเทิง
"ชาวเน็ตถาม มือใคร? ภาพถ่าย ""บอล เชิญยิ้ม"" ในงานศพ ""โรเบิร์ต สายควัน""",https://www.sanook.com/news/8259578/,24-ก.ย.-63,"785,118",ข่าวบันเทิง_50.txt,ข่าวบันเทิง
รำลึกดาราที่จากไป แต่ยังอยู่ในความทรงจำเสมอ,https://www.sanook.com/news/1839975/,31-ก.ค.-58,"779,668",ข่าวบันเทิง_51.txt,ข่าวบันเทิง
เพื่อนเจ้าสาวงานแต่งชมพู่ น็อต สวยในธีมสีเขียว,https://www.sanook.com/news/1791354/,6-พ.ค.-58,"771,156",ข่าวบันเทิง_52.txt,ข่าวบันเทิง
รพ.รามาฯ ออกแถลงการณ์ ปอ ทฤษฎี เสียชีวิตแล้ว,https://www.sanook.com/news/1933322/,18-ม.ค.-59,"766,705",ข่าวบันเทิง_53.txt,ข่าวบันเทิง
"""วุ้นเส้น วิริฒิพา"" ให้กำลังใจ ""ชาคริต-แอน"" ร่วมฟังสวดอภิธรรม ""คุณแม่สมลักษณ์""",https://www.sanook.com/news/7991530/,24-ธ.ค.-62,"760,277",ข่าวบันเทิง_54.txt,ข่าวบันเทิง
อั้ม บินด่วนจากปารีสกลับไทย จัดงานศพสุนัขแสนรัก,https://www.sanook.com/news/1781046/,16-เม.ย.-58,"758,440",ข่าวบันเทิง_55.txt,ข่าวบันเทิง
"""ธัญญ่า อาร์สยาม"" สวย แซ่บ ใจถึง เปลือยท่อนบนใช้ผมปิดอก สะกดทุกสายตา (คลิป)",https://www.sanook.com/news/8491650/,20-ธ.ค.-64,"755,473",ข่าวบันเทิง_56.txt,ข่าวบันเทิง
"เพื่อนน้อง บ. กิ๊ก ""ปีเตอร์"" สาวไส้เละ ผู้หญิงรับรู้ทุกอย่างเเต่อยากได้",https://www.sanook.com/news/1829870/,14-ก.ค.-58,"752,418",ข่าวบันเทิง_57.txt,ข่าวบันเทิง
ชมพู่ อารยา สู้ตาย! เจอคลื่นมหาชนเบียดกลางพรมแดง,https://www.sanook.com/news/1799130/,21-พ.ค.-58,"751,323",ข่าวบันเทิง_58.txt,ข่าวบันเทิง
"""แม่ชีวิตหนูพังแล้ว"" คำพูดสั้นๆ จาก ""แตงโม""",https://www.sanook.com/news/1825207/,7-ก.ค.-58,"748,628",ข่าวบันเทิง_59.txt,ข่าวบันเทิง
จ๋า ณัฐฐาวีรนุช ช็อก! น้องสาวแท้ๆ ดิ่งตึกดับ ทิ้งข้อความบอกลา,https://www.sanook.com/news/2055410/,26-ส.ค.-59,"747,210",ข่าวบันเทิง_60.txt,ข่าวบันเทิง
ย้อนรอยอุบัติเหตุดารา ประสบการณ์เฉียดตาย..จำไม่รู้ลืม,https://www.sanook.com/news/1732421/,16-ม.ค.-58,"742,188",ข่าวบันเทิง_61.txt,ข่าวบันเทิง
มัม ลาโคนิคส์ ป่วยเข้าโรงพยาบาล ผอมซูบจำแทบไม่ได้,https://www.sanook.com/news/1864426/,12-ก.ย.-58,"739,251",ข่าวบันเทิง_62.txt,ข่าวบันเทิง
ตั๊ก บงกช อัดคลิปถามเจ้าสัวบุญชัย นอกใจหรือเปล่า,https://www.sanook.com/news/1720725/,25-ธ.ค.-57,"738,087",ข่าวบันเทิง_63.txt,ข่าวบันเทิง
"สายตรงถึง ""ตุ๊ก ชนกวนันท์"" มีคำตอบแล้ว แต่งงานครั้งที่สอง?",https://www.sanook.com/news/7879390/,28-ส.ค.-62,"738,042",ข่าวบันเทิง_64.txt,ข่าวบันเทิง
"ละมุนจริง ""โต๋ ศักดิ์สิทธิ์"" กุมมือ ""ไบรท์"" เดินเคียงกัน บ่าวสาวเวอร์ชั่นนี้สวยหล่อมาก (คลิป)",https://www.sanook.com/news/8354686/,8-มี.ค.-64,"737,977",ข่าวบันเทิง_65.txt,ข่าวบันเทิง
"""ปีเตอร์"" สุดกลั้นน้ำตากอดลูกร้องไห้สูญเสียน้องชาย ""พลอย"" อดีตภรรยาเคียงข้างให้กำลังใจ",https://www.sanook.com/news/7963699/,25-พ.ย.-62,"730,815",ข่าวบันเทิง_66.txt,ข่าวบันเทิง
เปิดทรัพย์สิน ขวัญ อุษามณี ที่สร้างให้ครอบครัวแม่และพี่สาว,https://www.sanook.com/news/2081586/,11-ต.ค.-59,"729,171",ข่าวบันเทิง_67.txt,ข่าวบันเทิง
"""นี่ก็เงินปอ นี่ก็รถปอ"" ลุงขายเฉาก๊วย เล่าถึงความดี ปอ ทฤษฎี",https://www.sanook.com/news/1939542/,28-ม.ค.-59,"728,170",ข่าวบันเทิง_68.txt,ข่าวบันเทิง
"คุณแม่ของ ""น้ำผึ้ง ณัฐริกา"" อายุ 73 ปี ยังสวยแซ่บหุ่นดีมาก",https://www.sanook.com/news/1993950/,12-พ.ค.-59,"726,995",ข่าวบันเทิง_69.txt,ข่าวบันเทิง
เปิดอาณาจักร เสี่ยตา ปัญญา รวยทั้งเงินรวยทั้งความสุข,https://www.sanook.com/news/1432617/,4-ก.พ.-57,"720,257",ข่าวบันเทิง_70.txt,ข่าวบันเทิง
"""มิน พีชญา"" ทำโฟกัสจุดอื่นไม่ได้จริงๆ อ้าปากค้างท่อนล่างแซ่บเวอร์",https://www.sanook.com/news/8437638/,3-ก.ย.-64,"720,154",ข่าวบันเทิง_71.txt,ข่าวบันเทิง
แอฟ ทักษอร คลอดลูกให้ สงกรานต์ ได้ชื่นชมแล้ว,https://www.sanook.com/news/1724035/,1-ม.ค.-58,"714,889",ข่าวบันเทิง_72.txt,ข่าวบันเทิง
เอมมี่ น้ำตาคลอ!! หมดหนทางช่วยแม่ จำใจเล่นหนังสยิว,https://www.sanook.com/news/1709205/,2-ธ.ค.-57,"710,964",ข่าวบันเทิง_73.txt,ข่าวบันเทิง
จอย รินลณี เปิดใจข่าวความสัมพันธ์กับ สรยุทธ,https://www.sanook.com/news/1263672/,14-ต.ค.-56,"709,244",ข่าวบันเทิง_74.txt,ข่าวบันเทิง
"""เป๊ก สัณชัย"" เคลื่อนไหวบ้าง หลังดราม่าเดือด ""ธัญญ่า"" ออกโรงจัดการเด็กล้ำเส้น",https://www.sanook.com/news/8245030/,3-ก.ย.-63,"708,956",ข่าวบันเทิง_75.txt,ข่าวบันเทิง
ชมพู่ อารยา จัดปาร์ตี้สละโสด 3 พระเอกโผล่เซอร์ไพรส์,https://www.sanook.com/news/1787743/,29-เม.ย.-58,"702,652",ข่าวบันเทิง_76.txt,ข่าวบันเทิง
แอบส่อง ชาคริต วุ้นเส้น สวีทหวานที่หัวหิน,https://www.sanook.com/news/1725489/,4-ม.ค.-58,"698,935",ข่าวบันเทิง_77.txt,ข่าวบันเทิง
"กวาง กมลชนก โพสต์อุทาหรณ์ ""บางทีสิว อาจไม่ใช่แค่สิว""",https://www.sanook.com/news/2076842/,2-ต.ค.-59,"693,744",ข่าวบันเทิง_78.txt,ข่าวบันเทิง
วิวาห์ชื่นมื่น เซน ณิชา ลูกสาวคนสวย แอ๊ด คาราบาว,https://www.sanook.com/news/2162170/,1-ก.พ.-60,"692,922",ข่าวบันเทิง_79.txt,ข่าวบันเทิง
เจนี่ ฮอตร้อนฉ่า เปลือยทั้งตัว โชว์ท่ายาก,https://www.sanook.com/news/1748837/,15-ก.พ.-58,"691,128",ข่าวบันเทิง_80.txt,ข่าวบันเทิง
"ปิน เห็นภาพคนแชร์ใบหน้า ""พี่ปอ ทฤษฎี"" เผยสังคมลงโทษเขาไปแล้ว",https://www.sanook.com/news/1934606/,20-ม.ค.-59,"690,988",ข่าวบันเทิง_81.txt,ข่าวบันเทิง
"เปิดโพสต์ ""แตงโม"" ในวันวาเลนไทน์ กับประโยคที่อ่านแล้วต้องสะดุด",https://www.sanook.com/news/8523130/,25-ก.พ.-65,"689,200",ข่าวบันเทิง_82.txt,ข่าวบันเทิง
"เปิดภาพความน่ารัก ""ฝน ฮอร์โมน"" กับหนุ่มนักแข่งรถ ก่อนเกิดอุบัติเหตุ",https://www.sanook.com/news/7972618/,4-ธ.ค.-62,"684,339",ข่าวบันเทิง_83.txt,ข่าวบันเทิง
เผยโฉมผู้ชายต้นเรื่องคลิปตบชุลมุน แพท ณปภา,https://www.sanook.com/news/1925786/,5-ม.ค.-59,"683,242",ข่าวบันเทิง_84.txt,ข่าวบันเทิง
"เปิดจดหมาย ""พ่อแตงโม ภัทรธิดา"" เคยเขียนให้ลูกสาวสุดที่รัก",https://www.sanook.com/news/1825043/,6-ก.ค.-58,"681,979",ข่าวบันเทิง_85.txt,ข่าวบันเทิง
ไก่ วรายุฑ กุมขมับ! พาเหรดช่อง3 มีดราม่า,https://www.sanook.com/news/1787034/,27-เม.ย.-58,"681,906",ข่าวบันเทิง_86.txt,ข่าวบันเทิง
แพท ณปภา แถลงเปิดใจครั้งแรก เรื่องแต่งงาน-ตั้งท้อง,https://www.sanook.com/news/2069150/,19-ก.ย.-59,"680,818",ข่าวบันเทิง_87.txt,ข่าวบันเทิง
